{
  "schemaVersion": 2,
  "sources": [
    {
      "key": "rifttheory_anivia_official_kit_interpretation",
      "label": "RiftTheory provisional interpretation of the official Anivia kit",
      "kind": "manual",
      "url": "https://www.leagueoflegends.com/en-us/champions/anivia/",
      "accessNote": "Riot documents the ability kit. Trait levels and contextual conclusions are provisional RiftTheory interpretations, not Riot ratings."
    },
    {
      "key": "rifttheory_xerath_official_kit_interpretation",
      "label": "RiftTheory provisional interpretation of the official Xerath kit",
      "kind": "manual",
      "url": "https://www.leagueoflegends.com/en-us/champions/xerath/",
      "accessNote": "Riot documents the ability kit. Trait levels and contextual conclusions are provisional RiftTheory interpretations, not Riot ratings."
    },
    {
      "key": "rifttheory_vi_official_kit_interpretation",
      "label": "RiftTheory provisional interpretation of the official Vi kit",
      "kind": "manual",
      "url": "https://www.leagueoflegends.com/en-us/champions/vi/",
      "accessNote": "Riot documents Vi as a Fighter/Assassin and documents Vault Breaker and Cease and Desist. Trait levels and draft conclusions are provisional RiftTheory interpretations, not Riot ratings or counter statistics."
    },
    {
      "key": "rifttheory_interaction_model_v1",
      "label": "RiftTheory interaction model v1",
      "kind": "manual",
      "url": null,
      "accessNote": "A transparent draft heuristic. It is not a matchup win rate, counter table or calibrated probability model."
    }
  ],
  "profiles": [
    {
      "champion": { "name": "Anivia" },
      "role": "mid",
      "patch": null,
      "assessmentMethod": "manual",
      "reviewStatus": "provisional",
      "sourceKey": "rifttheory_anivia_official_kit_interpretation",
      "traits": [
        {
          "trait": "wave_clear",
          "level": 4,
          "confidence": 0.7,
          "reasoning": "Glacial Storm supplies persistent area damage and slowing around a wave.",
          "conditions": ["Requires mana and a usable position near the wave."]
        },
        {
          "trait": "wave_access_safety",
          "level": 2,
          "confidence": 0.55,
          "reasoning": "Her wave tool is area-based, but using it safely still depends on positioning, enemy reach and allied setup.",
          "conditions": [
            "This level is contextual and must be revisited by matchup and patch."
          ]
        },
        {
          "trait": "terrain_control",
          "level": 4,
          "confidence": 0.75,
          "reasoning": "Crystallize blocks movement and Glacial Storm controls a persistent area.",
          "conditions": [
            "Value depends on terrain, approach angle and displacement interactions."
          ]
        }
      ]
    },
    {
      "champion": { "name": "Xerath" },
      "role": "mid",
      "patch": null,
      "assessmentMethod": "manual",
      "reviewStatus": "provisional",
      "sourceKey": "rifttheory_xerath_official_kit_interpretation",
      "traits": [
        {
          "trait": "threat_range",
          "level": 5,
          "confidence": 0.75,
          "reasoning": "His spell pattern applies repeated pressure from long range, including a long-range ultimate.",
          "conditions": [
            "Threat depends on skill-shot access, cooldowns and vision."
          ]
        },
        {
          "trait": "poke",
          "level": 5,
          "confidence": 0.75,
          "reasoning": "Multiple ranged spells can damage or slow opponents before a committed fight.",
          "conditions": [
            "Value depends on accuracy, mana and enemy sustain or engage threat."
          ]
        },
        {
          "trait": "wave_clear",
          "level": 3,
          "confidence": 0.6,
          "reasoning": "Area spells can affect multiple minions while maintaining distance.",
          "conditions": ["The rating does not represent a measured clear time."]
        }
      ]
    },
    {
      "champion": { "name": "Vi" },
      "role": "jungle",
      "patch": null,
      "assessmentMethod": "manual",
      "reviewStatus": "provisional",
      "sourceKey": "rifttheory_vi_official_kit_interpretation",
      "traits": [
        {
          "trait": "engage",
          "level": 5,
          "confidence": 0.75,
          "reasoning": "Vault Breaker can begin contact and Cease and Desist supplies committed targeted initiation.",
          "conditions": [
            "Engage value depends on approach access, target selection and allied follow-up."
          ]
        },
        {
          "trait": "target_access",
          "level": 5,
          "confidence": 0.8,
          "reasoning": "Cease and Desist selects an enemy champion, carries Vi toward that target, knocks intervening enemies aside and knocks the target up.",
          "conditions": [
            "Reaching a target does not guarantee a favorable exit or enough follow-up damage."
          ]
        },
        {
          "trait": "mobility",
          "level": 3,
          "confidence": 0.65,
          "reasoning": "Vault Breaker provides directional movement, while Cease and Desist provides target-bound access.",
          "conditions": [
            "Directional access still requires a usable approach and does not itself provide a safe exit."
          ]
        }
      ]
    }
  ],
  "rules": [
    {
      "ruleKey": "range_pressure_constrains_wave_access",
      "subjectTrait": "threat_range",
      "objectTrait": "wave_access_safety",
      "comparison": "subject_greater",
      "subjectMinimum": 4,
      "objectMinimum": 1,
      "minimumDifference": 2,
      "relation": "constrains",
      "severity": "warning",
      "subjectImpact": "favorable",
      "condition": "The ranged threat can contest the space from which the opposing champion must access the wave.",
      "effect": "Wave clear still exists, but safe access cannot be assumed. Check allied setup, fog, cooldowns, mana and positioning before treating it as reliable draft coverage.",
      "patch": null,
      "confidence": 0.55,
      "reviewStatus": "provisional",
      "sourceKey": "rifttheory_interaction_model_v1"
    }
  ]
}
